{"schemaVersion":"4.0","cardId":1003010023,"categoryCode":10,"mythologyCode":3,"seriesCode":1,"seriesLabel":"M01","styleCode":0,"styleName":"Primordial Saga","cardNumber":23,"type":"scene","slug":"mimisbrunnr","titleZh":"密米尔之井","titleEn":"Mímisbrunnr","description":"世界树结构中的知识之井，本套不提前表现奥丁献眼。","roleInSeries":"预埋M02知识线但不越界。","storyIds":["story-yggdrasil-and-wells"],"sourceRefs":[{"sourceId":"norse-src-grimnismal","locator":"st. 31"}],"seriesNarrative":null,"visualThesis":"幽深水面是中心，周围结构简洁、安静。","composition":{"orientation":"portrait","subjectAnchor":{"x":0.5,"y":0.42},"cropSafe":{"sacrificialBottomStart":0.7,"sideCropTolerance":0.14,"mustRemainVisible":["still well","root-world context"]}},"prompt":{"draft":"Mimisbrunnr as a deep still well within Yggdrasil's root-world, quiet dark water, minimal stone and root forms, no Odin sacrifice scene.","final":null,"negative":["typography","logo","card frame","watermark","Odin sacrifice","glowing magic pool","glossy game-CG"],"notes":"确认出图后写入完整可重放 prompt.final。"},"generation":{"status":"planned","attempt":0,"approvedAt":null,"referenceImageFile":null,"notes":""},"output":{"fileName":"1003010023.png","width":1620,"height":2880,"format":"png"},"qa":{"status":"planned","reviewNotes":[]}}