{"schemaVersion":"4.0","cardId":1003010050,"categoryCode":10,"mythologyCode":3,"seriesCode":1,"seriesLabel":"M01","styleCode":0,"styleName":"Primordial Saga","cardNumber":50,"type":"ensemble","slug":"yggdrasil-and-fate","titleZh":"世界树与命运","titleEn":"Yggdrasil & Fate","description":"世界成形后的M01终章横版封面。","roleInSeries":"与49形成未成形/已成形的镜像。","storyIds":["story-yggdrasil-and-wells","story-norns-at-urdarbrunnr","story-sun-and-moon-chase"],"sourceRefs":[{"sourceId":"norse-src-grimnismal","locator":"sts. 31–35"},{"sourceId":"norse-src-voluspa","locator":"st. 20; st. 5"}],"seriesNarrative":null,"visualThesis":"世界树为绝对一级视觉中心，诺恩与日月只做小比例次级层级。","composition":{"orientation":"landscape","subjectAnchor":{"x":0.5,"y":0.45},"cropSafe":{"sacrificialBottomStart":0.9,"sideCropTolerance":0.12,"mustRemainVisible":["Yggdrasil","Norns","sun-moon order"]}},"prompt":{"draft":"horizontal series finale cover, Yggdrasil as the dominant central world-axis, small Norns and sun-moon elements secondary, broad calm background, no character collage.","final":null,"negative":["typography","logo","card frame","watermark","character collage","equal-detail-everywhere","glossy game-CG"],"notes":"确认出图后写入完整可重放 prompt.final。"},"generation":{"status":"planned","attempt":0,"approvedAt":null,"referenceImageFile":null,"notes":""},"output":{"fileName":"1003010050.png","width":2880,"height":1620,"format":"png"},"qa":{"status":"planned","reviewNotes":[]}}