{"schemaVersion":"4.0","cardId":1003010043,"categoryCode":10,"mythologyCode":3,"seriesCode":1,"seriesLabel":"M01","styleCode":0,"styleName":"Primordial Saga","cardNumber":43,"type":"story","slug":"three-roots-three-wells","titleZh":"三根通向三泉","titleEn":"Three Roots toward Three Wells","description":"世界树的根系把不同泉域纳入宇宙结构。","fullDescription":"世界树的根延伸至不同方向，并与重要泉域相连。命运、知识和原初水源由此被放到同一宇宙结构中，但它们各有不同来源和功能，不应画成三个相同的魔法水池。","roleInSeries":"连续Story第16段。","storyIds":["story-yggdrasil-and-wells"],"sourceRefs":[{"sourceId":"norse-src-grimnismal","locator":"sts. 31–35"}],"seriesNarrative":{"seriesTitle":"北欧创世：世界树与命运","seriesSummary":"从金伦加鸿沟的冰火相遇开始，经原初生命、尤弥尔之躯化世界、人类诞生、世界树与命运，最终以日月运行和毁灭伏线收束。","chapter":5,"chapterTitle":"世界树与命运","sequence":16,"keyMoment":"三根通向三泉","narrative":"世界树的根延伸至不同方向，并与重要泉域相连。命运、知识和原初水源由此被放到同一宇宙结构中，但它们各有不同来源和功能，不应画成三个相同的魔法水池。","previousCardId":1003010042,"nextCardId":1003010044},"visualThesis":"三条主要根向不同空间分化，泉域只作远处差异提示。","composition":{"orientation":"portrait","subjectAnchor":{"x":0.5,"y":0.4},"cropSafe":{"sacrificialBottomStart":0.7,"sideCropTolerance":0.14,"mustRemainVisible":["three roots","distinct water realms"]}},"prompt":{"draft":"three major roots of Yggdrasil diverging toward distinct distant water realms, broad readable structure, no identical glowing magic pools.","final":null,"negative":["typography","logo","card frame","watermark","identical magic pools","glowing UI","glossy game-CG"],"notes":"确认出图后写入完整可重放 prompt.final。"},"generation":{"status":"planned","attempt":0,"approvedAt":null,"referenceImageFile":null,"notes":""},"output":{"fileName":"1003010043.png","width":1620,"height":2880,"format":"png"},"qa":{"status":"planned","reviewNotes":[]}}