{"schemaVersion":"4.0","cardId":1003010029,"categoryCode":10,"mythologyCode":3,"seriesCode":1,"seriesLabel":"M01","styleCode":0,"styleName":"Primordial Saga","cardNumber":29,"type":"story","slug":"embers-cross-boundary","titleZh":"火星越过边界","titleEn":"Embers Cross the Boundary","description":"穆斯贝尔的热力与火星进入寒冷原初空间。","fullDescription":"与北方寒流相对，南方穆斯贝尔的热力与火星逼近鸿沟。寒冷与火焰在原初间隙相遇，使霜开始融化；世界的第一步因此是一场物质状态的变化。","roleInSeries":"连续Story第2段。","storyIds":["story-ymir-creation"],"sourceRefs":[{"sourceId":"norse-src-prose-edda-gylfaginning","locator":"chs. 4–5"}],"seriesNarrative":{"seriesTitle":"北欧创世：世界树与命运","seriesSummary":"从金伦加鸿沟的冰火相遇开始，经原初生命、尤弥尔之躯化世界、人类诞生、世界树与命运，最终以日月运行和毁灭伏线收束。","chapter":1,"chapterTitle":"鸿沟与寒流","sequence":2,"keyMoment":"火星越过边界","narrative":"与北方寒流相对，南方穆斯贝尔的热力与火星逼近鸿沟。寒冷与火焰在原初间隙相遇，使霜开始融化；世界的第一步因此是一场物质状态的变化。","previousCardId":1003010028,"nextCardId":1003010030},"visualThesis":"热与冷的接触点明确，避免火山大片。","composition":{"orientation":"portrait","subjectAnchor":{"x":0.5,"y":0.38},"cropSafe":{"sacrificialBottomStart":0.7,"sideCropTolerance":0.14,"mustRemainVisible":["heat-cold contact point","primordial void"]}},"prompt":{"draft":"embers and warm air crossing into primordial cold mist, one simple meeting boundary, no volcanic spectacle or particle storm.","final":null,"negative":["typography","logo","card frame","watermark","volcano landscape","particle storm","formed world","glossy game-CG"],"notes":"确认出图后写入完整可重放 prompt.final。"},"generation":{"status":"planned","attempt":0,"approvedAt":null,"referenceImageFile":null,"notes":""},"output":{"fileName":"1003010029.png","width":1620,"height":2880,"format":"png"},"qa":{"status":"planned","reviewNotes":[]}}