{"schemaVersion":"4.0","cardId":1003010012,"categoryCode":10,"mythologyCode":3,"seriesCode":1,"seriesLabel":"M01","styleCode":0,"styleName":"Primordial Saga","cardNumber":12,"type":"character","slug":"sol","titleZh":"索尔","titleEn":"Sól","description":"人格化的太阳运行者，与太阳之车共同构成天体秩序。","roleInSeries":"把创世后的世界带入可循环的时间秩序。","storyIds":["story-sun-and-moon-chase"],"sourceRefs":[{"sourceId":"norse-src-voluspa","locator":"st. 5"},{"sourceId":"norse-src-prose-edda-gylfaginning","locator":"ch. 11"}],"seriesNarrative":null,"visualThesis":"人物与太阳运行关系清楚，背景大面积简化，不做普通太阳女神光环。","composition":{"orientation":"portrait","subjectAnchor":{"x":0.5,"y":0.3},"cropSafe":{"sacrificialBottomStart":0.7,"sideCropTolerance":0.14,"mustRemainVisible":["face","upper torso","solar relationship"]}},"prompt":{"draft":"Sol as the personified sun-runner, clear human figure with restrained solar light and hint of chariot system, simple sky background, no giant halo ornament.","final":null,"negative":["typography","logo","card frame","watermark","giant halo ornament","glossy game-CG","cosmic clutter"],"notes":"确认出图后写入完整可重放 prompt.final。"},"generation":{"status":"planned","attempt":0,"approvedAt":null,"referenceImageFile":null,"notes":""},"output":{"fileName":"1003010012.png","width":1620,"height":2880,"format":"png"},"qa":{"status":"planned","reviewNotes":[]}}