{"schemaVersion":"4.0","cardId":1003010016,"categoryCode":10,"mythologyCode":3,"seriesCode":1,"seriesLabel":"M01","styleCode":0,"styleName":"Primordial Saga","cardNumber":16,"type":"character","slug":"nidhoggr","titleZh":"尼德霍格","titleEn":"Níðhöggr","description":"在世界树根部持续啃噬、让宇宙秩序从诞生起就存在侵蚀的存在。","roleInSeries":"以根部侵蚀结束M01的稳定幻觉。","storyIds":["story-nidhoggr-and-yggdrasil"],"sourceRefs":[{"sourceId":"norse-src-grimnismal","locator":"st. 35"}],"seriesNarrative":null,"visualThesis":"头部与咬住根系的动作清楚，身体可隐入阴影，不做喷火巨龙。","composition":{"orientation":"portrait","subjectAnchor":{"x":0.5,"y":0.38},"cropSafe":{"sacrificialBottomStart":0.7,"sideCropTolerance":0.14,"mustRemainVisible":["head","bite action","Yggdrasil root"]}},"prompt":{"draft":"Nidhoggr biting a massive root of Yggdrasil, head and bite action clear, most body receding into soft shadow, no armored dragon, no fire-breathing spectacle.","final":null,"negative":["typography","logo","card frame","watermark","armored dragon","fire breathing","game boss","glossy game-CG"],"notes":"确认出图后写入完整可重放 prompt.final。"},"generation":{"status":"planned","attempt":0,"approvedAt":null,"referenceImageFile":null,"notes":""},"output":{"fileName":"1003010016.png","width":1620,"height":2880,"format":"png"},"qa":{"status":"planned","reviewNotes":[]}}