{"schemaVersion":"4.0","cardId":1003010026,"categoryCode":10,"mythologyCode":3,"seriesCode":1,"seriesLabel":"M01","styleCode":0,"styleName":"Primordial Saga","cardNumber":26,"type":"scene","slug":"celestial-path","titleZh":"天穹之路","titleEn":"Celestial Path","description":"日月获得运行秩序后的天空路径。","roleInSeries":"把世界推进到时间与周期。","storyIds":["story-sun-and-moon-chase"],"sourceRefs":[{"sourceId":"norse-src-voluspa","locator":"st. 5"}],"seriesNarrative":null,"visualThesis":"用光与云层节律表现运行，不画科幻轨道。","composition":{"orientation":"portrait","subjectAnchor":{"x":0.5,"y":0.38},"cropSafe":{"sacrificialBottomStart":0.7,"sideCropTolerance":0.14,"mustRemainVisible":["light path","sky rhythm"]}},"prompt":{"draft":"a mythic celestial path for sun and moon, broad light and cloud rhythm, simple sky architecture, no orbital UI or astrophotography star trails.","final":null,"negative":["typography","logo","card frame","watermark","orbital UI","star trails","sci-fi","glossy game-CG"],"notes":"确认出图后写入完整可重放 prompt.final。"},"generation":{"status":"planned","attempt":0,"approvedAt":null,"referenceImageFile":null,"notes":""},"output":{"fileName":"1003010026.png","width":1620,"height":2880,"format":"png"},"qa":{"status":"planned","reviewNotes":[]}}