{"schemaVersion":"4.0","cardId":1003010025,"categoryCode":10,"mythologyCode":3,"seriesCode":1,"seriesLabel":"M01","styleCode":0,"styleName":"Primordial Saga","cardNumber":25,"type":"scene","slug":"newborn-midgard","titleZh":"初生的米德加尔特","titleEn":"Newborn Midgard","description":"由尤弥尔之躯塑成、尚未出现成熟文明的新世界。","roleInSeries":"承接世界塑造到人类诞生。","storyIds":["story-odin-creates-world","story-ask-and-embla"],"sourceRefs":[{"sourceId":"norse-src-prose-edda-gylfaginning","locator":"ch. 8"}],"seriesNarrative":null,"visualThesis":"海、陆、山三个大形，禁止村庄、城堡和过度景观细节。","composition":{"orientation":"portrait","subjectAnchor":{"x":0.5,"y":0.4},"cropSafe":{"sacrificialBottomStart":0.7,"sideCropTolerance":0.14,"mustRemainVisible":["new land","sea","mountain forms"]}},"prompt":{"draft":"newborn Midgard with newly formed sea, land and mountains, raw broad geological shapes, no villages or castles, muted painterly atmosphere.","final":null,"negative":["typography","logo","card frame","watermark","villages","castles","mature civilization","hyper-detailed scenery","glossy game-CG"],"notes":"确认出图后写入完整可重放 prompt.final。"},"generation":{"status":"planned","attempt":0,"approvedAt":null,"referenceImageFile":null,"notes":""},"output":{"fileName":"1003010025.png","width":1620,"height":2880,"format":"png"},"qa":{"status":"planned","reviewNotes":[]}}