{"schemaVersion":"4.0","cardId":1003010002,"categoryCode":10,"mythologyCode":3,"seriesCode":1,"seriesLabel":"M01","styleCode":0,"styleName":"Primordial Saga","cardNumber":2,"type":"character","slug":"audhumla","titleZh":"奥德胡姆拉","titleEn":"Auðumbla","description":"以乳流滋养尤弥尔、舔开咸冰并使布里显现的原初母牛。","roleInSeries":"连接尤弥尔与神族祖先布里。","storyIds":["story-audhumla-and-buri"],"sourceRefs":[{"sourceId":"norse-src-prose-edda-gylfaginning","locator":"ch. 6"}],"seriesNarrative":null,"visualThesis":"自然、庄重的原初牛科形态，头肩位于上半部，背景只保留霜冰与盐石。","composition":{"orientation":"portrait","subjectAnchor":{"x":0.5,"y":0.32},"cropSafe":{"sacrificialBottomStart":0.7,"sideCropTolerance":0.14,"mustRemainVisible":["head","shoulders","primordial frost context"]}},"prompt":{"draft":"Audhumla, the primordial cow, dignified natural bovine anatomy, frost and salt-ice environment, subtle milk streams, no fantasy armor, clear subject against soft mist.","final":null,"negative":["typography","logo","card frame","watermark","hyper-detailed background","glossy game-CG"],"notes":"确认出图后写入完整可重放 prompt.final。"},"generation":{"status":"planned","attempt":0,"approvedAt":null,"referenceImageFile":null,"notes":""},"output":{"fileName":"1003010002.png","width":1620,"height":2880,"format":"png"},"qa":{"status":"planned","reviewNotes":[]}}