{"schemaVersion":"4.0","cardId":1003010047,"categoryCode":10,"mythologyCode":3,"seriesCode":1,"seriesLabel":"M01","styleCode":0,"styleName":"Primordial Saga","cardNumber":47,"type":"mythic-object","slug":"sun-chariot","titleZh":"太阳之车","titleEn":"Chariot of the Sun","description":"索尔驾驭、由阿尔瓦克与阿尔斯维德牵引的太阳运行载具。","roleInSeries":"M01正式神物之一，连接索尔与天体秩序。","storyIds":["story-sun-and-moon-chase"],"objectIds":["object-norse-sun-chariot"],"sourceRefs":[{"sourceId":"norse-src-prose-edda-gylfaginning","locator":"ch. 11"}],"seriesNarrative":null,"visualThesis":"战车轮廓与太阳关系清楚，背景只有简化天穹，不做游戏战车。","composition":{"orientation":"portrait","subjectAnchor":{"x":0.5,"y":0.38},"cropSafe":{"sacrificialBottomStart":0.7,"sideCropTolerance":0.14,"mustRemainVisible":["chariot silhouette","horses","solar relation"]}},"prompt":{"draft":"the Chariot of the Sun as a mythic celestial vehicle, clear readable chariot and solar relationship, restrained horses and sky, no ornate game equipment or excess VFX.","final":null,"negative":["typography","logo","card frame","watermark","ornate game equipment","excess VFX","glossy game-CG"],"notes":"确认出图后写入完整可重放 prompt.final。"},"generation":{"status":"planned","attempt":0,"approvedAt":null,"referenceImageFile":null,"notes":""},"output":{"fileName":"1003010047.png","width":1620,"height":2880,"format":"png"},"qa":{"status":"planned","reviewNotes":[]}}