{"schemaVersion":"4.0","cardId":1003010039,"categoryCode":10,"mythologyCode":3,"seriesCode":1,"seriesLabel":"M01","styleCode":0,"styleName":"Primordial Saga","cardNumber":39,"type":"story","slug":"skull-becomes-sky","titleZh":"头骨撑起天空","titleEn":"The Skull Becomes Sky","description":"三兄弟把尤弥尔的头盖骨安置为天穹。","fullDescription":"三兄弟把尤弥尔的头盖骨安置为天空，又把火星安排到天穹中。到这一刻，上下空间被明确区分，新世界从原初物质变成具有天地层次的宇宙。","roleInSeries":"连续Story第12段。","storyIds":["story-odin-creates-world"],"sourceRefs":[{"sourceId":"norse-src-prose-edda-gylfaginning","locator":"ch. 8"}],"seriesNarrative":{"seriesTitle":"北欧创世：世界树与命运","seriesSummary":"从金伦加鸿沟的冰火相遇开始，经原初生命、尤弥尔之躯化世界、人类诞生、世界树与命运，最终以日月运行和毁灭伏线收束。","chapter":3,"chapterTitle":"旧世界的终结","sequence":12,"keyMoment":"头骨撑起天空","narrative":"三兄弟把尤弥尔的头盖骨安置为天空，又把火星安排到天穹中。到这一刻，上下空间被明确区分，新世界从原初物质变成具有天地层次的宇宙。","previousCardId":1003010038,"nextCardId":1003010040},"visualThesis":"三兄弟与巨大弧形天穹关系清楚，背景不堆星云。","composition":{"orientation":"portrait","subjectAnchor":{"x":0.5,"y":0.36},"cropSafe":{"sacrificialBottomStart":0.7,"sideCropTolerance":0.14,"mustRemainVisible":["three brothers","skull-vault arc","new sky"]}},"prompt":{"draft":"Odin, Vili and Ve raising the vast skull-vault of Ymir into a new sky, simple monumental arc, minimal sparks, no nebula spectacle.","final":null,"negative":["typography","logo","card frame","watermark","nebula spectacle","starfield overload","glossy game-CG"],"notes":"确认出图后写入完整可重放 prompt.final。"},"generation":{"status":"planned","attempt":0,"approvedAt":null,"referenceImageFile":null,"notes":""},"output":{"fileName":"1003010039.png","width":1620,"height":2880,"format":"png"},"qa":{"status":"planned","reviewNotes":[]}}