{"schemaVersion":"4.0","cardId":1003010030,"categoryCode":10,"mythologyCode":3,"seriesCode":1,"seriesLabel":"M01","styleCode":0,"styleName":"Primordial Saga","cardNumber":30,"type":"story","slug":"ymir-awakens","titleZh":"尤弥尔苏醒","titleEn":"Ymir Awakens","description":"冰霜受热的生成中，尤弥尔作为原初巨人第一次显现。","fullDescription":"冰霜受热后产生的滴水获得生命，尤弥尔作为原初巨人出现。他不是普通巨人角色，而是连接巨人谱系与宇宙材料的起点；北欧创世由此第一次出现可以行动和繁衍的生命主体。","roleInSeries":"连续Story第3段。","storyIds":["story-ymir-creation"],"sourceRefs":[{"sourceId":"norse-src-prose-edda-gylfaginning","locator":"chs. 5–6"}],"seriesNarrative":{"seriesTitle":"北欧创世：世界树与命运","seriesSummary":"从金伦加鸿沟的冰火相遇开始，经原初生命、尤弥尔之躯化世界、人类诞生、世界树与命运，最终以日月运行和毁灭伏线收束。","chapter":1,"chapterTitle":"鸿沟与寒流","sequence":3,"keyMoment":"尤弥尔苏醒","narrative":"冰霜受热后产生的滴水获得生命，尤弥尔作为原初巨人出现。他不是普通巨人角色，而是连接巨人谱系与宇宙材料的起点；北欧创世由此第一次出现可以行动和繁衍的生命主体。","previousCardId":1003010029,"nextCardId":1003010031},"visualThesis":"尤弥尔脸与上身是绝对主体，背景只有融霜和雾。","composition":{"orientation":"portrait","subjectAnchor":{"x":0.5,"y":0.3},"cropSafe":{"sacrificialBottomStart":0.7,"sideCropTolerance":0.14,"mustRemainVisible":["Ymir face","upper torso","thawing frost"]}},"prompt":{"draft":"Ymir first awakening from melting frost, face and upper body as the sole focal subject, simple fog and thawing ice background, painterly and restrained.","final":null,"negative":["typography","logo","card frame","watermark","formed landscape","mountains","game boss","glossy game-CG"],"notes":"Story 版需引用已批准 1003010001 的 Ymir Canon；确认出图后写入完整可重放 prompt.final。"},"references":{"cardIds":[1003010001],"notes":"锁定Ymir脸型、体量和创世前冰火混沌Canon。"},"generation":{"status":"planned","attempt":0,"approvedAt":null,"referenceImageFile":null,"notes":""},"output":{"fileName":"1003010030.png","width":1620,"height":2880,"format":"png"},"qa":{"status":"planned","reviewNotes":[]}}