{"schemaVersion":"4.0","cardId":1003010022,"categoryCode":10,"mythologyCode":3,"seriesCode":1,"seriesLabel":"M01","styleCode":0,"styleName":"Primordial Saga","cardNumber":22,"type":"scene","slug":"urdarbrunnr","titleZh":"乌尔德之泉","titleEn":"Urðarbrunnr","description":"与世界树和诺恩命运秩序相连的泉域。","roleInSeries":"承载命运章节。","storyIds":["story-norns-at-urdarbrunnr"],"sourceRefs":[{"sourceId":"norse-src-voluspa","locator":"st. 20"}],"seriesNarrative":null,"visualThesis":"泉水、树根与安静空间三个大形即可，诺恩只做远景尺度。","composition":{"orientation":"portrait","subjectAnchor":{"x":0.5,"y":0.4},"cropSafe":{"sacrificialBottomStart":0.7,"sideCropTolerance":0.14,"mustRemainVisible":["spring","major root","quiet spatial identity"]}},"prompt":{"draft":"Urdarbrunnr beneath Yggdrasil, quiet clear spring and one major root, restrained natural ritual atmosphere, tiny distant figures only if needed.","final":null,"negative":["typography","logo","card frame","watermark","glowing magic pool","crowded ritual props","glossy game-CG"],"notes":"确认出图后写入完整可重放 prompt.final。"},"generation":{"status":"planned","attempt":0,"approvedAt":null,"referenceImageFile":null,"notes":""},"output":{"fileName":"1003010022.png","width":1620,"height":2880,"format":"png"},"qa":{"status":"planned","reviewNotes":[]}}