{"schemaVersion":"4.0","cardId":1003010014,"categoryCode":10,"mythologyCode":3,"seriesCode":1,"seriesLabel":"M01","styleCode":0,"styleName":"Primordial Saga","cardNumber":14,"type":"character","slug":"skoll","titleZh":"斯库尔","titleEn":"Sköll","description":"《欺骗古鲁菲》中追逐太阳的狼。","roleInSeries":"把末日压力提前埋入日常天空。","storyIds":["story-sun-and-moon-chase"],"sourceRefs":[{"sourceId":"norse-src-prose-edda-gylfaginning","locator":"ch. 12"}],"seriesNarrative":null,"visualThesis":"狼头与前躯清楚、太阳只做远处目标，不做装甲Boss。","composition":{"orientation":"portrait","subjectAnchor":{"x":0.5,"y":0.35},"cropSafe":{"sacrificialBottomStart":0.7,"sideCropTolerance":0.14,"mustRemainVisible":["wolf head","front torso","distant sun target"]}},"prompt":{"draft":"Skoll in a strong upward chase toward distant sunlight, natural powerful wolf anatomy, simple clouded sky, no armor, no Fenrir copy.","final":null,"negative":["typography","logo","card frame","watermark","armor","Fenrir clone","game boss","glossy game-CG"],"notes":"确认出图后写入完整可重放 prompt.final。"},"generation":{"status":"planned","attempt":0,"approvedAt":null,"referenceImageFile":null,"notes":""},"output":{"fileName":"1003010014.png","width":1620,"height":2880,"format":"png"},"qa":{"status":"planned","reviewNotes":[]}}