{"schemaVersion":"4.0","cardId":1003010017,"categoryCode":10,"mythologyCode":3,"seriesCode":1,"seriesLabel":"M01","styleCode":0,"styleName":"Primordial Saga","cardNumber":17,"type":"scene","slug":"ginnungagap","titleZh":"金伦加鸿沟","titleEn":"Ginnungagap","description":"寒冷与热力相遇前尚未稳定的原初间隙。","roleInSeries":"M01一切事件的空间起点。","storyIds":["story-ymir-creation"],"sourceRefs":[{"sourceId":"norse-src-prose-edda-gylfaginning","locator":"chs. 4–5"}],"seriesNarrative":null,"visualThesis":"用冰雾与远处热光两大形表达原初空间，不做峡谷旅游照。","composition":{"orientation":"portrait","subjectAnchor":{"x":0.5,"y":0.38},"cropSafe":{"sacrificialBottomStart":0.7,"sideCropTolerance":0.14,"mustRemainVisible":["cold-hot boundary","vast empty gap"]}},"prompt":{"draft":"Ginnungagap as a vast unformed gap between cold mist and distant heat, broad simple masses, minimal landmarks, atmospheric painterly space.","final":null,"negative":["typography","logo","card frame","watermark","tourist canyon","formed landscape","city","glossy game-CG"],"notes":"确认出图后写入完整可重放 prompt.final。"},"generation":{"status":"planned","attempt":0,"approvedAt":null,"referenceImageFile":null,"notes":""},"output":{"fileName":"1003010017.png","width":1620,"height":2880,"format":"png"},"qa":{"status":"planned","reviewNotes":[]}}