{"schemaVersion":"4.0","cardId":1003010024,"categoryCode":10,"mythologyCode":3,"seriesCode":1,"seriesLabel":"M01","styleCode":0,"styleName":"Primordial Saga","cardNumber":24,"type":"scene","slug":"hvergelmir","titleZh":"赫瓦格密尔","titleEn":"Hvergelmir","description":"与世界树根和原初水脉源头相连的泉。","roleInSeries":"完成三泉空间层次。","storyIds":["story-yggdrasil-and-wells"],"sourceRefs":[{"sourceId":"norse-src-grimnismal","locator":"st. 26"}],"seriesNarrative":null,"visualThesis":"水源向外发散的结构清楚，其他背景雾化。","composition":{"orientation":"portrait","subjectAnchor":{"x":0.5,"y":0.4},"cropSafe":{"sacrificialBottomStart":0.7,"sideCropTolerance":0.14,"mustRemainVisible":["source spring","branching waters","roots"]}},"prompt":{"draft":"Hvergelmir as an ancient source spring feeding branching waters beneath vast roots, one clear source point, cold mist, simplified background.","final":null,"negative":["typography","logo","card frame","watermark","glowing magic pool","excess detail","glossy game-CG"],"notes":"确认出图后写入完整可重放 prompt.final。"},"generation":{"status":"planned","attempt":0,"approvedAt":null,"referenceImageFile":null,"notes":""},"output":{"fileName":"1003010024.png","width":1620,"height":2880,"format":"png"},"qa":{"status":"planned","reviewNotes":[]}}