{"schemaVersion":"4.0","cardId":1003010004,"categoryCode":10,"mythologyCode":3,"seriesCode":1,"seriesLabel":"M01","styleCode":0,"styleName":"Primordial Saga","cardNumber":4,"type":"character","slug":"odin-creator","titleZh":"奥丁·创世者","titleEn":"Odin · Creator","description":"创世阶段参与尤弥尔之死与世界塑造的奥丁，不使用后期完整王权造型。","roleInSeries":"建立奥丁创世阶段的视觉Canon。","storyIds":["story-odin-creates-world"],"sourceRefs":[{"sourceId":"norse-src-prose-edda-gylfaginning","locator":"ch. 8"}],"seriesNarrative":null,"visualThesis":"朴素、行动中的创世者，独眼身份保留，背景简化为未完成世界。","composition":{"orientation":"portrait","subjectAnchor":{"x":0.5,"y":0.31},"cropSafe":{"sacrificialBottomStart":0.7,"sideCropTolerance":0.14,"mustRemainVisible":["one eye","face","upper torso"]}},"prompt":{"draft":"creator-era Odin, one-eyed, restrained functional clothing, strong simple silhouette, no royal throne or franchise armor, unfinished world softly behind him.","final":null,"negative":["typography","logo","card frame","watermark","royal throne","franchise armor","glossy game-CG"],"notes":"确认出图后写入完整可重放 prompt.final。"},"generation":{"status":"planned","attempt":0,"approvedAt":null,"referenceImageFile":null,"notes":""},"output":{"fileName":"1003010004.png","width":1620,"height":2880,"format":"png"},"qa":{"status":"planned","reviewNotes":[]}}