{"schemaVersion":"4.0","cardId":1003010038,"categoryCode":10,"mythologyCode":3,"seriesCode":1,"seriesLabel":"M01","styleCode":0,"styleName":"Primordial Saga","cardNumber":38,"type":"story","slug":"mountains-from-bones","titleZh":"骨化群山","titleEn":"Mountains from Bones","description":"尤弥尔的骨与牙齿化为山石。","fullDescription":"尤弥尔的骨与牙齿被转化为山石。大地不再是一整块平面，而获得起伏、岩层和可以区分的空间结构。","roleInSeries":"连续Story第11段。","storyIds":["story-odin-creates-world"],"sourceRefs":[{"sourceId":"norse-src-prose-edda-gylfaginning","locator":"ch. 8"}],"seriesNarrative":{"seriesTitle":"北欧创世：世界树与命运","seriesSummary":"从金伦加鸿沟的冰火相遇开始，经原初生命、尤弥尔之躯化世界、人类诞生、世界树与命运，最终以日月运行和毁灭伏线收束。","chapter":3,"chapterTitle":"旧世界的终结","sequence":11,"keyMoment":"骨化群山","narrative":"尤弥尔的骨与牙齿被转化为山石。大地不再是一整块平面，而获得起伏、岩层和可以区分的空间结构。","previousCardId":1003010037,"nextCardId":1003010039},"visualThesis":"骨骼向山体大形过渡，减少纹理密度。","composition":{"orientation":"portrait","subjectAnchor":{"x":0.5,"y":0.4},"cropSafe":{"sacrificialBottomStart":0.7,"sideCropTolerance":0.14,"mustRemainVisible":["bone-to-mountain transition","broad mountain forms"]}},"prompt":{"draft":"bones and teeth of Ymir transforming symbolically into broad mountain forms, restrained painterly geology, no body-horror detail.","final":null,"negative":["typography","logo","card frame","watermark","body horror","gore","micro-detailed geology","glossy game-CG"],"notes":"确认出图后写入完整可重放 prompt.final。"},"generation":{"status":"planned","attempt":0,"approvedAt":null,"referenceImageFile":null,"notes":""},"output":{"fileName":"1003010038.png","width":1620,"height":2880,"format":"png"},"qa":{"status":"planned","reviewNotes":[]}}