{"schemaVersion":"4.0","cardId":1003010035,"categoryCode":10,"mythologyCode":3,"seriesCode":1,"seriesLabel":"M01","styleCode":0,"styleName":"Primordial Saga","cardNumber":35,"type":"story","slug":"ymir-falls","titleZh":"尤弥尔倒下","titleEn":"Ymir Falls","description":"三兄弟杀死尤弥尔，原初秩序结束。","fullDescription":"三兄弟杀死尤弥尔。这个事件不是单纯的英雄战斗，而是宇宙结构转换的门槛；在这一散文传统中，新秩序以原初存在的死亡为代价。","roleInSeries":"连续Story第8段。","storyIds":["story-odin-creates-world"],"sourceRefs":[{"sourceId":"norse-src-prose-edda-gylfaginning","locator":"ch. 8"}],"seriesNarrative":{"seriesTitle":"北欧创世：世界树与命运","seriesSummary":"从金伦加鸿沟的冰火相遇开始，经原初生命、尤弥尔之躯化世界、人类诞生、世界树与命运，最终以日月运行和毁灭伏线收束。","chapter":3,"chapterTitle":"旧世界的终结","sequence":8,"keyMoment":"尤弥尔倒下","narrative":"三兄弟杀死尤弥尔。这个事件不是单纯的英雄战斗，而是宇宙结构转换的门槛；在这一散文传统中，新秩序以原初存在的死亡为代价。","previousCardId":1003010034,"nextCardId":1003010036},"visualThesis":"倒下的巨大上身和三兄弟是唯一信息，不强调血腥。","composition":{"orientation":"portrait","subjectAnchor":{"x":0.5,"y":0.33},"cropSafe":{"sacrificialBottomStart":0.7,"sideCropTolerance":0.14,"mustRemainVisible":["Ymir scale","falling body","three brothers"]}},"prompt":{"draft":"Ymir collapsing at world scale while the three brothers remain small but readable, mythic solemnity, no gore spectacle, simplified environment.","final":null,"negative":["typography","logo","card frame","watermark","gore spectacle","battle clutter","glossy game-CG"],"notes":"需引用1003010001锁定Ymir体量；确认出图后写入完整可重放 prompt.final。"},"references":{"cardIds":[1003010001],"notes":"沿用approved Ymir Canon。"},"generation":{"status":"planned","attempt":0,"approvedAt":null,"referenceImageFile":null,"notes":""},"output":{"fileName":"1003010035.png","width":1620,"height":2880,"format":"png"},"qa":{"status":"planned","reviewNotes":[]}}