{"schemaVersion":"4.0","cardId":1003010019,"categoryCode":10,"mythologyCode":3,"seriesCode":1,"seriesLabel":"M01","styleCode":0,"styleName":"Primordial Saga","cardNumber":19,"type":"scene","slug":"muspell","titleZh":"穆斯贝尔","titleEn":"Múspell","description":"与寒域相对的火焰和热力边界。","roleInSeries":"定义创世南侧力量。","storyIds":["story-ymir-creation"],"sourceRefs":[{"sourceId":"norse-src-prose-edda-gylfaginning","locator":"chs. 4–5"}],"seriesNarrative":null,"visualThesis":"一个清楚的火热边界大形，不提前出现苏尔特或末日军队。","composition":{"orientation":"portrait","subjectAnchor":{"x":0.5,"y":0.4},"cropSafe":{"sacrificialBottomStart":0.7,"sideCropTolerance":0.14,"mustRemainVisible":["fire boundary","primordial heat"]}},"prompt":{"draft":"primordial Muspell as a simple vast heat-and-fire boundary, dark ground and broad flame light, no armies, no Surtr, no particle overload.","final":null,"negative":["typography","logo","card frame","watermark","Surtr","armies","particle overload","glossy game-CG"],"notes":"确认出图后写入完整可重放 prompt.final。"},"generation":{"status":"planned","attempt":0,"approvedAt":null,"referenceImageFile":null,"notes":""},"output":{"fileName":"1003010019.png","width":1620,"height":2880,"format":"png"},"qa":{"status":"planned","reviewNotes":[]}}