{"schemaVersion":"4.0","cardId":1003010033,"categoryCode":10,"mythologyCode":3,"seriesCode":1,"seriesLabel":"M01","styleCode":0,"styleName":"Primordial Saga","cardNumber":33,"type":"story","slug":"buri-emerges","titleZh":"冰中显现的布里","titleEn":"Búri Emerges from Ice","description":"奥德胡姆拉逐日舔开咸冰，使布里完整显现。","fullDescription":"奥德胡姆拉舔食带盐的冰块，第一日显出头发，第二日显出头，第三日布里完整显现。神族祖先因此不是从天而降，而是逐步从同一片原初物质中出现，并最终连到奥丁、威利与维的谱系。","roleInSeries":"连续Story第6段。","storyIds":["story-audhumla-and-buri"],"sourceRefs":[{"sourceId":"norse-src-prose-edda-gylfaginning","locator":"ch. 6"}],"seriesNarrative":{"seriesTitle":"北欧创世：世界树与命运","seriesSummary":"从金伦加鸿沟的冰火相遇开始，经原初生命、尤弥尔之躯化世界、人类诞生、世界树与命运，最终以日月运行和毁灭伏线收束。","chapter":2,"chapterTitle":"原初生命与祖先","sequence":6,"keyMoment":"冰中显现的布里","narrative":"奥德胡姆拉舔食带盐的冰块，第一日显出头发，第二日显出头，第三日布里完整显现。神族祖先因此不是从天而降，而是逐步从同一片原初物质中出现，并最终连到奥丁、威利与维的谱系。","previousCardId":1003010032,"nextCardId":1003010034},"visualThesis":"布里的脸和上身从冰面显出，奥德胡姆拉头部作为动作来源。","composition":{"orientation":"portrait","subjectAnchor":{"x":0.5,"y":0.33},"cropSafe":{"sacrificialBottomStart":0.7,"sideCropTolerance":0.14,"mustRemainVisible":["Buri face","upper torso","Audhumla action"]}},"prompt":{"draft":"Buri emerging from salt ice as Audhumla licks the surface, Buri face and upper torso clear, restrained frost environment, one action only.","final":null,"negative":["typography","logo","card frame","watermark","crown","throne","multi-panel story","glossy game-CG"],"notes":"确认出图后写入完整可重放 prompt.final。"},"generation":{"status":"planned","attempt":0,"approvedAt":null,"referenceImageFile":null,"notes":""},"output":{"fileName":"1003010033.png","width":1620,"height":2880,"format":"png"},"qa":{"status":"planned","reviewNotes":[]}}