{"schemaVersion":"4.0","cardId":1003010040,"categoryCode":10,"mythologyCode":3,"seriesCode":1,"seriesLabel":"M01","styleCode":0,"styleName":"Primordial Saga","cardNumber":40,"type":"story","slug":"two-timbers-on-shore","titleZh":"海岸上的两段木材","titleEn":"Two Timbers on the Shore","description":"阿斯克与恩布拉获得生命前，海岸上出现两段木材。","fullDescription":"在已经形成的世界海岸，三位神发现阿斯克与恩布拉的前身。他们尚无呼吸、意识与完整生命，这让人类起源与树木、海岸和新世界的材料直接相连。","roleInSeries":"连续Story第13段。","storyIds":["story-ask-and-embla"],"sourceRefs":[{"sourceId":"norse-src-voluspa","locator":"sts. 17–18"}],"seriesNarrative":{"seriesTitle":"北欧创世：世界树与命运","seriesSummary":"从金伦加鸿沟的冰火相遇开始，经原初生命、尤弥尔之躯化世界、人类诞生、世界树与命运，最终以日月运行和毁灭伏线收束。","chapter":4,"chapterTitle":"人类进入世界","sequence":13,"keyMoment":"海岸上的两段木材","narrative":"在已经形成的世界海岸，三位神发现阿斯克与恩布拉的前身。他们尚无呼吸、意识与完整生命，这让人类起源与树木、海岸和新世界的材料直接相连。","previousCardId":1003010039,"nextCardId":1003010041},"visualThesis":"两段木材与海岸构成安静画面，神只做远处提示。","composition":{"orientation":"portrait","subjectAnchor":{"x":0.5,"y":0.42},"cropSafe":{"sacrificialBottomStart":0.7,"sideCropTolerance":0.14,"mustRemainVisible":["two timbers","young shore"]}},"prompt":{"draft":"two human-origin timbers lying on a quiet young Midgard shore, simple sea and sky, distant divine figures only if needed, contemplative composition.","final":null,"negative":["typography","logo","card frame","watermark","tree people","busy divine crowd","glossy game-CG"],"notes":"确认出图后写入完整可重放 prompt.final。"},"generation":{"status":"planned","attempt":0,"approvedAt":null,"referenceImageFile":null,"notes":""},"output":{"fileName":"1003010040.png","width":1620,"height":2880,"format":"png"},"qa":{"status":"planned","reviewNotes":[]}}