{"schemaVersion":"4.0","cardId":1003010049,"categoryCode":10,"mythologyCode":3,"seriesCode":1,"seriesLabel":"M01","styleCode":0,"styleName":"Primordial Saga","cardNumber":49,"type":"ensemble","slug":"norse-genesis","titleZh":"北欧创世","titleEn":"Norse Genesis","description":"冰火相遇与原初生命的系列开篇横版封面。","roleInSeries":"代表世界尚未形成。","storyIds":["story-ymir-creation"],"sourceRefs":[{"sourceId":"norse-src-prose-edda-gylfaginning","locator":"chs. 4–8"}],"seriesNarrative":null,"visualThesis":"尤弥尔是唯一主要角色，冰火两极只做大面积低细节背景。","composition":{"orientation":"landscape","subjectAnchor":{"x":0.5,"y":0.45},"cropSafe":{"sacrificialBottomStart":0.9,"sideCropTolerance":0.12,"mustRemainVisible":["Ymir","ice-fire primordial contrast"]}},"prompt":{"draft":"horizontal series cover, Ymir as the single dominant subject in Ginnungagap, simple cold-vs-warm environmental masses, painterly negative space, no galaxy or debris overload.","final":null,"negative":["typography","logo","card frame","watermark","formed world landscape","galaxy wallpaper","debris overload","glossy game-CG"],"notes":"必须引用1003010001锁定Ymir生前Canon；确认出图后写入完整可重放 prompt.final。"},"references":{"cardIds":[1003010001],"notes":"Ymir必须维持创世前、冰火混沌、世界级巨物体量。"},"generation":{"status":"planned","attempt":0,"approvedAt":null,"referenceImageFile":null,"notes":""},"output":{"fileName":"1003010049.png","width":2880,"height":1620,"format":"png"},"qa":{"status":"planned","reviewNotes":[]}}